
你 不 参加 比赛 就是 怕 输 吗 ？,你不参加比赛就是怕输吗？,nǐ bù cānjiā bǐsài jìushì pà shū ma ？,Are you afraid of losing if you don't participate in the competition?,[sound:hsk2_grammar_sent22.mp3],:: 就(是) + (不) + Verb ::,Emphasizing,"Emphasis with ""jiushi""",https://resources.allsetlearning.com/chinese/grammar/ASGY21RK
他 这样 说 就是 不 喜欢 我 。,他这样说就是不喜欢我。,tā zhèyáng shuō jìushì bù xǐhuān wǒ 。,He said that he didn't like me.,[sound:hsk2_grammar_sent23.mp3],:: 就(是) + (不) + Verb ::,Emphasizing,"Emphasis with ""jiushi""",https://resources.allsetlearning.com/chinese/grammar/ASGY21RK
她 问 这么 多，就是 担心 你 。,她问这么多，就是担心你。,tā wèn zhèyāo duō，jìushì dànxīn nǐ 。,"She asked so much, just worried about you.",[sound:hsk2_grammar_sent24.mp3],:: 就(是) + (不) + Verb ::,Emphasizing,"Emphasis with ""jiushi""",https://resources.allsetlearning.com/chinese/grammar/ASGY21RK
她 就是 漂亮 ，没 别的 优势 。,她就是漂亮，没别的优势。,tā jìushì piāoliàng ，méi biéde yōushì 。,She is beautiful and has no other advantages.,[sound:hsk2_grammar_sent25.mp3],:: 就(是) + (不) + Verb ::,Emphasizing,"Emphasis with ""jiushi""",https://resources.allsetlearning.com/chinese/grammar/ASGY21RK
我 就 要 去！,我就要去！,wǒ jìu yào qù！,I'm going!,[sound:hsk2_grammar_sent26.mp3],:: 就(是) + (不) + Verb ::,Emphasizing,"Emphasis with ""jiushi""",https://resources.allsetlearning.com/chinese/grammar/ASGY21RK
我 就是 喜欢 他 。,我就是喜欢他。,wǒ jìushì xǐhuān tā 。,I just like him.,[sound:hsk2_grammar_sent27.mp3],:: 就(是) + (不) + Verb ::,Emphasizing,"Emphasis with ""jiushi""",https://resources.allsetlearning.com/chinese/grammar/ASGY21RK
我 就 不 告诉 你 。,我就不告诉你。,wǒ jìu bù gàosù nǐ 。,I won't tell you.,[sound:hsk2_grammar_sent28.mp3],:: 就(是) + (不) + Verb ::,Emphasizing,"Emphasis with ""jiushi""",https://resources.allsetlearning.com/chinese/grammar/ASGY21RK
我 父母 就是 不 让 我 一个人 去 。,我父母就是不让我一个人去。,wǒ fùmǔ jìushì bù ràng wǒ yīgèrén qù 。,My parents just let me go alone.,[sound:hsk2_grammar_sent29.mp3],:: 就(是) + (不) + Verb ::,Emphasizing,"Emphasis with ""jiushi""",https://resources.allsetlearning.com/chinese/grammar/ASGY21RK
这个 学生 就是不 听 老师 的 话 。,这个学生就是不听老师的话。,zhègè xuéshēng jìushìbù tīng lǎoshī de huà 。,This student just doesn't listen to the teacher.,[sound:hsk2_grammar_sent30.mp3],:: 就(是) + (不) + Verb ::,Emphasizing,"Emphasis with ""jiushi""",https://resources.allsetlearning.com/chinese/grammar/ASGY21RK
很 多 地方 都 有 wifi 。,很多地方都有wifi。,hěn duō dìfāng dū yǒu wifi 。,There are wifi in many places.,[sound:hsk2_grammar_sent31.mp3],:: Subj. + 都 + Verb + Obj. ::,"Emphasizing, Expressing quantity","Emphasizing quantity with ""dou""",https://resources.allsetlearning.com/chinese/grammar/ASGWNEYM
我 的 很 多 朋友 都 有 车 。,我的很多朋友都有车。,wǒ de hěn duō péngyǒu dū yǒu chē 。,Many of my friends have cars.,[sound:hsk2_grammar_sent32.mp3],:: Subj. + 都 + Verb + Obj. ::,"Emphasizing, Expressing quantity","Emphasizing quantity with ""dou""",https://resources.allsetlearning.com/chinese/grammar/ASGWNEYM
很 多 美国人 都 喜欢 喝 咖啡 。,很多美国人都喜欢喝咖啡。,hěn duō měiguórén dū xǐhuān hē kāfēi 。,Many Americans like to drink coffee.,[sound:hsk2_grammar_sent33.mp3],:: Subj. + 都 + Verb + Obj. ::,"Emphasizing, Expressing quantity","Emphasizing quantity with ""dou""",https://resources.allsetlearning.com/chinese/grammar/ASGWNEYM
很 多 孩子 都 不 喜欢 上学 。,很多孩子都不喜欢上学。,hěn duō háizǐ dū bù xǐhuān shàngxué 。,Many children don't like going to school.,[sound:hsk2_grammar_sent34.mp3],:: Subj. + 都 + Verb + Obj. ::,"Emphasizing, Expressing quantity","Emphasizing quantity with ""dou""",https://resources.allsetlearning.com/chinese/grammar/ASGWNEYM
很 多 年轻人 都 想 在 大 城市 工作 。,很多年轻人都想在大城市工作。,hěn duō niánqīngrén dū xiǎng zài dà chéngshì gōngzuò 。,Many young people want to work in big cities.,[sound:hsk2_grammar_sent35.mp3],:: Subj. + 都 + Verb + Obj. ::,"Emphasizing, Expressing quantity","Emphasizing quantity with ""dou""",https://resources.allsetlearning.com/chinese/grammar/ASGWNEYM
大家 都 来 了 吗 ？,大家都来了吗？,dàjiā dū lái le ma ？,Is everyone here?,[sound:hsk2_grammar_sent36.mp3],:: Subj. + 都 + Verb + Obj. ::,"Emphasizing, Expressing quantity","Emphasizing quantity with ""dou""",https://resources.allsetlearning.com/chinese/grammar/ASGWNEYM
大家 都 应该 知道 。,大家都应该知道。,dàjiā dū yìnggāi zhīdào 。,Everyone should know.,[sound:hsk2_grammar_sent37.mp3],:: Subj. + 都 + Verb + Obj. ::,"Emphasizing, Expressing quantity","Emphasizing quantity with ""dou""",https://resources.allsetlearning.com/chinese/grammar/ASGWNEYM
大家 都 说 你 很 聪明 。,大家都说你很聪明。,dàjiā dū shuō nǐ hěn cōngmíng 。,Everyone says you are smart.,[sound:hsk2_grammar_sent38.mp3],:: Subj. + 都 + Verb + Obj. ::,"Emphasizing, Expressing quantity","Emphasizing quantity with ""dou""",https://resources.allsetlearning.com/chinese/grammar/ASGWNEYM
大家 都 忘 了 他 的 名字 。,大家都忘了他的名字。,dàjiā dū wàng le tā de míngzì 。,Everyone forgot his name.,[sound:hsk2_grammar_sent39.mp3],:: Subj. + 都 + Verb + Obj. ::,"Emphasizing, Expressing quantity","Emphasizing quantity with ""dou""",https://resources.allsetlearning.com/chinese/grammar/ASGWNEYM
大家 都 喜欢 吃辣 吗 ？,大家都喜欢吃辣吗？,dàjiā dū xǐhuān chīlà ma ？,Does everyone like spicy food?,[sound:hsk2_grammar_sent40.mp3],:: Subj. + 都 + Verb + Obj. ::,"Emphasizing, Expressing quantity","Emphasizing quantity with ""dou""",https://resources.allsetlearning.com/chinese/grammar/ASGWNEYM
我 每天 都 要 上班 。,我每天都要上班。,wǒ měitiān dū yào shàngbān 。,I have to go to work every day.,[sound:hsk2_grammar_sent41.mp3],:: Subj. + 都 + Verb + Obj. ::,"Emphasizing, Expressing quantity","Emphasizing quantity with ""dou""",https://resources.allsetlearning.com/chinese/grammar/ASGWNEYM
老师 每天 都 迟到 。,老师每天都迟到。,lǎoshī měitiān dū chídào 。,The teacher is late every day.,[sound:hsk2_grammar_sent42.mp3],:: Subj. + 都 + Verb + Obj. ::,"Emphasizing, Expressing quantity","Emphasizing quantity with ""dou""",https://resources.allsetlearning.com/chinese/grammar/ASGWNEYM
她 每天 都 不 吃 早饭 。,她每天都不吃早饭。,tā měitiān dū bù chī zǎofàn 。,She doesn't eat breakfast every day.,[sound:hsk2_grammar_sent43.mp3],:: Subj. + 都 + Verb + Obj. ::,"Emphasizing, Expressing quantity","Emphasizing quantity with ""dou""",https://resources.allsetlearning.com/chinese/grammar/ASGWNEYM
我 女朋友 每天 都 上 淘宝 。,我女朋友每天都上淘宝。,wǒ nv̌péngyǒu měitiān dū shàng táobǎo 。,My girlfriend goes to Taobao every day.,[sound:hsk2_grammar_sent44.mp3],:: Subj. + 都 + Verb + Obj. ::,"Emphasizing, Expressing quantity","Emphasizing quantity with ""dou""",https://resources.allsetlearning.com/chinese/grammar/ASGWNEYM
妈妈 每天 都 给 我们 做 晚饭 。,妈妈每天都给我们做晚饭。,māmā měitiān dū gěi wǒmen zuò wǎnfàn 。,Mother cooks dinner for us every day.,[sound:hsk2_grammar_sent45.mp3],:: Subj. + 都 + Verb + Obj. ::,"Emphasizing, Expressing quantity","Emphasizing quantity with ""dou""",https://resources.allsetlearning.com/chinese/grammar/ASGWNEYM
美国人 都 说 英文 。,美国人都说英文。,měiguórén dū shuō yīngwén 。,Americans speak English.,[sound:hsk2_grammar_sent46.mp3],:: Subj. + 都 + Verb + Obj. ::,"Emphasizing, Expressing quantity","Emphasizing quantity with ""dou""",https://resources.allsetlearning.com/chinese/grammar/ASGWNEYM
我们 五 个 人 都 去 。,我们五个人都去。,wǒmen wǔ gè rén dū qù 。,All five of us go.,[sound:hsk2_grammar_sent47.mp3],:: Subj. + 都 + Verb + Obj. ::,"Emphasizing, Expressing quantity","Emphasizing quantity with ""dou""",https://resources.allsetlearning.com/chinese/grammar/ASGWNEYM
四川人 都 喜欢 吃辣 。,四川人都喜欢吃辣。,sìchuānrén dū xǐhuān chīlà 。,People in Sichuan like to eat spicy food.,[sound:hsk2_grammar_sent48.mp3],:: Subj. + 都 + Verb + Obj. ::,"Emphasizing, Expressing quantity","Emphasizing quantity with ""dou""",https://resources.allsetlearning.com/chinese/grammar/ASGWNEYM
我 的 家人 都 没 去 过 中国 。,我的家人都没去过中国。,wǒ de jiārén dū méi qù guò zhōngguó 。,None of my family has been to China.,[sound:hsk2_grammar_sent49.mp3],:: Subj. + 都 + Verb + Obj. ::,"Emphasizing, Expressing quantity","Emphasizing quantity with ""dou""",https://resources.allsetlearning.com/chinese/grammar/ASGWNEYM
我 的 学生 都 喜欢 问 问题 。,我的学生都喜欢问问题。,wǒ de xuéshēng dū xǐhuān wèn wèntí 。,My students like to ask questions.,[sound:hsk2_grammar_sent50.mp3],:: Subj. + 都 + Verb + Obj. ::,"Emphasizing, Expressing quantity","Emphasizing quantity with ""dou""",https://resources.allsetlearning.com/chinese/grammar/ASGWNEYM
就 要 下雨 了 。,就要下雨了。,jìu yào xiàyǔ le 。,It's going to rain.,[sound:hsk2_grammar_sent51.mp3],:: (Subj. +) 就要 + Verb + 了 (，⋯⋯) ::,"Sequencing events in time, Expressing time and date, Referring to changes of situation","Expressing ""about to"" with ""jiuyao""",https://resources.allsetlearning.com/chinese/grammar/ASG9B210
他们 就 要 结婚 了 。,他们就要结婚了。,tāmen jìu yào jiéhūn le 。,They are getting married.,[sound:hsk2_grammar_sent52.mp3],:: (Subj. +) 就要 + Verb + 了 (，⋯⋯) ::,"Sequencing events in time, Expressing time and date, Referring to changes of situation","Expressing ""about to"" with ""jiuyao""",https://resources.allsetlearning.com/chinese/grammar/ASG9B210
我 就 要 出国 了 。,我就要出国了。,wǒ jìu yào chūguó le 。,I am going abroad.,[sound:hsk2_grammar_sent53.mp3],:: (Subj. +) 就要 + Verb + 了 (，⋯⋯) ::,"Sequencing events in time, Expressing time and date, Referring to changes of situation","Expressing ""about to"" with ""jiuyao""",https://resources.allsetlearning.com/chinese/grammar/ASG9B210
宝宝 就 要 一岁 了 。,宝宝就要一岁了。,bǎobǎo jìu yào yīsùi le 。,The baby is about one year old.,[sound:hsk2_grammar_sent54.mp3],:: (Subj. +) 就要 + Verb + 了 (，⋯⋯) ::,"Sequencing events in time, Expressing time and date, Referring to changes of situation","Expressing ""about to"" with ""jiuyao""",https://resources.allsetlearning.com/chinese/grammar/ASG9B210
就 要 下课 了 ，还有 别的 问题 吗 ？,就要下课了，还有别的问题吗？,jìu yào xiàkè le ，huányǒu biéde wèntí ma ？,"Class is coming, are there any other questions?",[sound:hsk2_grammar_sent55.mp3],:: 还有 + Time (+ Subj.) + 就 (要) + Verb + 了 ::,"Sequencing events in time, Expressing time and date, Referring to changes of situation","Expressing ""about to"" with ""jiuyao""",https://resources.allsetlearning.com/chinese/grammar/ASG9B210
还有 十 分钟 我 就 下班 了 。,还有十分钟我就下班了。,huányǒu shí fēnzhōng wǒ jìu xiàbān le 。,I will be off work in ten minutes.,[sound:hsk2_grammar_sent56.mp3],:: 还有 + Time (+ Subj.) + 就 (要) + Verb + 了 ::,"Sequencing events in time, Expressing time and date, Referring to changes of situation","Expressing ""about to"" with ""jiuyao""",https://resources.allsetlearning.com/chinese/grammar/ASG9B210
还有 两 个 星期 我们 就 要 考试 了 。,还有两个星期我们就要考试了。,huányǒu liǎng gè xīngqī wǒmen jìu yào kǎoshì le 。,We are about to take the exam in two weeks.,[sound:hsk2_grammar_sent57.mp3],:: 还有 + Time (+ Subj.) + 就 (要) + Verb + 了 ::,"Sequencing events in time, Expressing time and date, Referring to changes of situation","Expressing ""about to"" with ""jiuyao""",https://resources.allsetlearning.com/chinese/grammar/ASG9B210
还有 一 个 月 就 要 过年 了 。,还有一个月就要过年了。,huányǒu yī gè yuè jìu yào guònián le 。,It's another month before the New Year.,[sound:hsk2_grammar_sent58.mp3],:: 还有 + Time (+ Subj.) + 就 (要) + Verb + 了 ::,"Sequencing events in time, Expressing time and date, Referring to changes of situation","Expressing ""about to"" with ""jiuyao""",https://resources.allsetlearning.com/chinese/grammar/ASG9B210
还有 半 个 小时 飞机 就 起飞 了 。,还有半个小时飞机就起飞了。,huányǒu bàn gè xiǎoshí fēijī jìu qǐfēi le 。,The plane took off in half an hour.,[sound:hsk2_grammar_sent59.mp3],:: 还有 + Time (+ Subj.) + 就 (要) + Verb + 了 ::,"Sequencing events in time, Expressing time and date, Referring to changes of situation","Expressing ""about to"" with ""jiuyao""",https://resources.allsetlearning.com/chinese/grammar/ASG9B210
还有 五 天 就 要 放假 了 。,还有五天就要放假了。,huányǒu wǔ tiān jìu yào fàngjiǎ le 。,There are five days to go on vacation.,[sound:hsk2_grammar_sent60.mp3],:: 还有 + Time (+ Subj.) + 就 (要) + Verb + 了 ::,"Sequencing events in time, Expressing time and date, Referring to changes of situation","Expressing ""about to"" with ""jiuyao""",https://resources.allsetlearning.com/chinese/grammar/ASG9B210
我们 明年 再 来 。,我们明年再来。,wǒmen míngnián zài lái 。,We will come again next year.,[sound:hsk2_grammar_sent61.mp3],:: Subj. + 再 + [Verb Phrase] ::,Expressing time and date,"Expressing ""again"" in the future with ""zai""",https://resources.allsetlearning.com/chinese/grammar/ASGIZQJ2
再 试 一下 。,再试一下。,zài shì yīxià 。,Try again.,[sound:hsk2_grammar_sent62.mp3],:: Subj. + 再 + [Verb Phrase] ::,Expressing time and date,"Expressing ""again"" in the future with ""zai""",https://resources.allsetlearning.com/chinese/grammar/ASGIZQJ2
你 可以 再 说 一 遍 吗 ？,你可以再说一遍吗？,nǐ kěyǐ zài shuō yī biàn ma ？,Can you say it again?,[sound:hsk2_grammar_sent63.mp3],:: Subj. + 再 + [Verb Phrase] ::,Expressing time and date,"Expressing ""again"" in the future with ""zai""",https://resources.allsetlearning.com/chinese/grammar/ASGIZQJ2
这 本 书 我 要 再 看 一 遍 。,这本书我要再看一遍。,zhè běn shū wǒ yào zài kàn yī biàn 。,I will read this book again.,[sound:hsk2_grammar_sent64.mp3],:: Subj. + 再 + [Verb Phrase] ::,Expressing time and date,"Expressing ""again"" in the future with ""zai""",https://resources.allsetlearning.com/chinese/grammar/ASGIZQJ2
你 应该 再 复习 一 遍 。,你应该再复习一遍。,nǐ yìnggāi zài fùxí yī biàn 。,You should review it again.,[sound:hsk2_grammar_sent65.mp3],:: Subj. + 再 + [Verb Phrase] ::,Expressing time and date,"Expressing ""again"" in the future with ""zai""",https://resources.allsetlearning.com/chinese/grammar/ASGIZQJ2
再 吃 一点 。,再吃一点。,zài chī yīdiǎn 。,Eat a little more.,[sound:hsk2_grammar_sent66.mp3],:: Subj. + 再 + Verb + Obj. ::,Expressing time and date,"Expressing ""again"" in the future with ""zai""",https://resources.allsetlearning.com/chinese/grammar/ASGIZQJ2
再 点 几个 菜 吧 。,再点几个菜吧。,zài diǎn jīgè cài ba 。,Order more dishes.,[sound:hsk2_grammar_sent67.mp3],:: Subj. + 再 + Verb + Obj. ::,Expressing time and date,"Expressing ""again"" in the future with ""zai""",https://resources.allsetlearning.com/chinese/grammar/ASGIZQJ2
服务员 ，再 来 两 瓶 啤酒 。,服务员，再来两瓶啤酒。,fúwùyuán ，zài lái liǎng píng píjǐu 。,"Waiter, two more beers.",[sound:hsk2_grammar_sent68.mp3],:: Subj. + 再 + Verb + Obj. ::,Expressing time and date,"Expressing ""again"" in the future with ""zai""",https://resources.allsetlearning.com/chinese/grammar/ASGIZQJ2
再 给 我 三天 时间 。,再给我三天时间。,zài gěi wǒ sāntiān shíjiān 。,Give me another three days.,[sound:hsk2_grammar_sent69.mp3],:: Subj. + 再 + Verb + Obj. ::,Expressing time and date,"Expressing ""again"" in the future with ""zai""",https://resources.allsetlearning.com/chinese/grammar/ASGIZQJ2
我 能 不 能 再 拿 两 个 ？,我能不能再拿两个？,wǒ néng bù néng zài ná liǎng gè ？,Can I get two more?,[sound:hsk2_grammar_sent70.mp3],:: Subj. + 再 + Verb + Obj. ::,Expressing time and date,"Expressing ""again"" in the future with ""zai""",https://resources.allsetlearning.com/chinese/grammar/ASGIZQJ2
再 找找 。,再找找。,zài zhǎozhǎo 。,Look again.,[sound:hsk2_grammar_sent71.mp3],:: Subj. + 再 + Verb + Verb ::,Expressing time and date,"Expressing ""again"" in the future with ""zai""",https://resources.allsetlearning.com/chinese/grammar/ASGIZQJ2
你 再 问问 。,你再问问。,nǐ zài wènwèn 。,You ask again.,[sound:hsk2_grammar_sent72.mp3],:: Subj. + 再 + Verb + Verb ::,Expressing time and date,"Expressing ""again"" in the future with ""zai""",https://resources.allsetlearning.com/chinese/grammar/ASGIZQJ2
别 急 ，再 想想 。,别急，再想想。,bié jí ，zài xiǎngxiǎng 。,"Don't worry, think again.",[sound:hsk2_grammar_sent73.mp3],:: Subj. + 再 + Verb + Verb ::,Expressing time and date,"Expressing ""again"" in the future with ""zai""",https://resources.allsetlearning.com/chinese/grammar/ASGIZQJ2
再 聊 一会儿 。,再聊一会儿。,zài liáo yīhùiér 。,Chat for a while.,[sound:hsk2_grammar_sent74.mp3],:: Subj. + 再 + Verb + Verb ::,Expressing time and date,"Expressing ""again"" in the future with ""zai""",https://resources.allsetlearning.com/chinese/grammar/ASGIZQJ2
再 等 一会儿 。,再等一会儿。,zài děng yīhùiér 。,Wait a little longer.,[sound:hsk2_grammar_sent75.mp3],:: Subj. + 再 + Verb + Verb ::,Expressing time and date,"Expressing ""again"" in the future with ""zai""",https://resources.allsetlearning.com/chinese/grammar/ASGIZQJ2
都 九点 了 ，快点 起床 ！,都九点了，快点起床！,dū jǐudiǎn le ，kuàidiǎn qǐchuáng ！,"It's nine o'clock, get up quickly!",[sound:hsk2_grammar_sent76.mp3],:: 都 + Time + 了 ::,"Expressing attitude, Emphasizing","Expressing ""already"" with ""dou""",https://resources.allsetlearning.com/chinese/grammar/ASGT1CIR
都 十二 点 了 ，你 还 不 睡 ？,都十二点了，你还不睡？,dū shíèr diǎn le ，nǐ huán bù shùi ？,"It's twelve o'clock, are you still sleeping?",[sound:hsk2_grammar_sent77.mp3],:: 都 + Time + 了 ::,"Expressing attitude, Emphasizing","Expressing ""already"" with ""dou""",https://resources.allsetlearning.com/chinese/grammar/ASGT1CIR
都 二十一 世纪 了 ，你 还 这么 想 ？,都二十一世纪了，你还这么想？,dū èrshíyī shìjì le ，nǐ huán zhèyāo xiǎng ？,"It's the 21st century, do you still think so?",[sound:hsk2_grammar_sent78.mp3],:: 都 + Time + 了 ::,"Expressing attitude, Emphasizing","Expressing ""already"" with ""dou""",https://resources.allsetlearning.com/chinese/grammar/ASGT1CIR
都 一 个 小时 了 ，他 还 在 厕所 里 。,都一个小时了，他还在厕所里。,dū yī gè xiǎoshí le ，tā huán zài cèsuǒ lǐ 。,"It's been an hour, he is still in the toilet.",[sound:hsk2_grammar_sent79.mp3],:: 都 + Time + 了 ::,"Expressing attitude, Emphasizing","Expressing ""already"" with ""dou""",https://resources.allsetlearning.com/chinese/grammar/ASGT1CIR
都 一 个 星期 了 ，还在 下雨 。,都一个星期了，还在下雨。,dū yī gè xīngqī le ，huánzài xiàyǔ 。,It's been a week and it's still raining.,[sound:hsk2_grammar_sent80.mp3],:: 都 + Time + 了 ::,"Expressing attitude, Emphasizing","Expressing ""already"" with ""dou""",https://resources.allsetlearning.com/chinese/grammar/ASGT1CIR
饭 都 凉 了 ，快 吃 吧 。,饭都凉了，快吃吧。,fàn dū liáng le ，kuài chī ba 。,"The food is cold, eat it.",[sound:hsk2_grammar_sent81.mp3],:: Subj. + 都 + Predicate + 了 ::,"Expressing attitude, Emphasizing","Expressing ""already"" with ""dou""",https://resources.allsetlearning.com/chinese/grammar/ASGT1CIR
牛奶 都 坏 了 ，扔掉 吧 。,牛奶都坏了，扔掉吧。,níunǎi dū huài le ，rēngdiào ba 。,"The milk is broken, throw it away.",[sound:hsk2_grammar_sent82.mp3],:: Subj. + 都 + Predicate + 了 ::,"Expressing attitude, Emphasizing","Expressing ""already"" with ""dou""",https://resources.allsetlearning.com/chinese/grammar/ASGT1CIR
我 都 说 了 三 遍 了 。,我都说了三遍了。,wǒ dū shuō le sān biàn le 。,I have said it three times.,[sound:hsk2_grammar_sent83.mp3],:: Subj. + 都 + Predicate + 了 ::,"Expressing attitude, Emphasizing","Expressing ""already"" with ""dou""",https://resources.allsetlearning.com/chinese/grammar/ASGT1CIR
这个 电影 你 都 看 过 了 ，看 别的 吧 。,这个电影你都看过了，看别的吧。,zhègè diànyǐng nǐ dū kàn guò le ，kàn biéde ba 。,"You have watched this movie, watch something else.",[sound:hsk2_grammar_sent84.mp3],:: Subj. + 都 + Predicate + 了 ::,"Expressing attitude, Emphasizing","Expressing ""already"" with ""dou""",https://resources.allsetlearning.com/chinese/grammar/ASGT1CIR
他 都 道歉 了 ，你 别 生气 了 。,他都道歉了，你别生气了。,tā dū dàoqiàn le ，nǐ bié shēngqì le 。,"He all apologized, don't be angry.",[sound:hsk2_grammar_sent85.mp3],:: Subj. + 都 + Predicate + 了 ::,"Expressing attitude, Emphasizing","Expressing ""already"" with ""dou""",https://resources.allsetlearning.com/chinese/grammar/ASGT1CIR
他们 已经 走 了 。,他们已经走了。,tāmen yǐjīng zǒu le 。,They are gone.,[sound:hsk2_grammar_sent86.mp3],:: 已经 + [Verb Phrase] + 了 ::,Emphasizing,"Expressing ""already"" with ""yijing""",https://resources.allsetlearning.com/chinese/grammar/ASGNXI27
我 已经 有 男朋友 了 。,我已经有男朋友了。,wǒ yǐjīng yǒu nánpéngyǒu le 。,I already have a boyfriend.,[sound:hsk2_grammar_sent87.mp3],:: 已经 + [Verb Phrase] + 了 ::,Emphasizing,"Expressing ""already"" with ""yijing""",https://resources.allsetlearning.com/chinese/grammar/ASGNXI27
宝宝 已经 会 说话 了 。,宝宝已经会说话了。,bǎobǎo yǐjīng hùi shuōhuà le 。,The baby can already speak.,[sound:hsk2_grammar_sent88.mp3],:: 已经 + [Verb Phrase] + 了 ::,Emphasizing,"Expressing ""already"" with ""yijing""",https://resources.allsetlearning.com/chinese/grammar/ASGNXI27
妈妈 已经 回来 了 。,妈妈已经回来了。,māmā yǐjīng húilái le 。,Mom has returned.,[sound:hsk2_grammar_sent89.mp3],:: 已经 + [Verb Phrase] + 了 ::,Emphasizing,"Expressing ""already"" with ""yijing""",https://resources.allsetlearning.com/chinese/grammar/ASGNXI27
他 已经 上 飞机 了 。,他已经上飞机了。,tā yǐjīng shàng fēijī le 。,He is already on the plane.,[sound:hsk2_grammar_sent90.mp3],:: 已经 + [Verb Phrase] + 了 ::,Emphasizing,"Expressing ""already"" with ""yijing""",https://resources.allsetlearning.com/chinese/grammar/ASGNXI27
爸爸 妈妈 已经 老 了 。,爸爸妈妈已经老了。,bàbà māmā yǐjīng lǎo le 。,Mom and Dad are already old.,[sound:hsk2_grammar_sent91.mp3],:: 已经 + (很 +) Adj. + 了 ::,Emphasizing,"Expressing ""already"" with ""yijing""",https://resources.allsetlearning.com/chinese/grammar/ASGNXI27
已经 很 便宜 了 。,已经很便宜了。,yǐjīng hěn biànyí le 。,It's already very cheap.,[sound:hsk2_grammar_sent92.mp3],:: 已经 + (很 +) Adj. + 了 ::,Emphasizing,"Expressing ""already"" with ""yijing""",https://resources.allsetlearning.com/chinese/grammar/ASGNXI27
你 女朋友 已经 很 漂亮 了！,你女朋友已经很漂亮了！,nǐ nv̌péngyǒu yǐjīng hěn piāoliàng le！,Your girlfriend is already pretty!,[sound:hsk2_grammar_sent93.mp3],:: 已经 + (很 +) Adj. + 了 ::,Emphasizing,"Expressing ""already"" with ""yijing""",https://resources.allsetlearning.com/chinese/grammar/ASGNXI28
你 的 感冒 已经 好 了 吗 ？,你的感冒已经好了吗？,nǐ de gǎnmào yǐjīng hǎo le ma ？,Is your cold cured?,[sound:hsk2_grammar_sent94.mp3],:: 已经 + (很 +) Adj. + 了 ::,Emphasizing,"Expressing ""already"" with ""yijing""",https://resources.allsetlearning.com/chinese/grammar/ASGNXI27
已经 很 晚 了，我们 走 吧 。,已经很晚了，我们走吧。,yǐjīng hěn wǎn le，wǒmen zǒu ba 。,"It's very late, let's go.",[sound:hsk2_grammar_sent95.mp3],:: 已经 + (很 +) Adj. + 了 ::,Emphasizing,"Expressing ""already"" with ""yijing""",https://resources.allsetlearning.com/chinese/grammar/ASGNXI27
已经 11点 了，女儿 还 没 回来 。,已经11点了，女儿还没回来。,yǐjīng 11diǎn le，nv̌ér huán méi húilái 。,It's 11 o'clock and my daughter hasn't returned.,[sound:hsk2_grammar_sent96.mp3],:: 已经 + Time + 了 ::,Emphasizing,"Expressing ""already"" with ""yijing""",https://resources.allsetlearning.com/chinese/grammar/ASGNXI27
爷爷 已经 八十五 岁 了 。,爷爷已经八十五岁了。,yéyé yǐjīng bāshíwǔ sùi le 。,Grandpa is eighty-five years old.,[sound:hsk2_grammar_sent97.mp3],:: 已经 + Time + 了 ::,Emphasizing,"Expressing ""already"" with ""yijing""",https://resources.allsetlearning.com/chinese/grammar/ASGNXI27
