
他们 七 八 年 没 见面 了 。,他们七八年没见面了。,tāmen qī bā nián méi jiànmiàn le 。,They haven't seen each other for seven or eight years.,[sound:hsk3_grammar_sent327.mp3],:: Number + (Number + 1) ::,Expressing quantity,Approximating with sequential numbers,https://resources.allsetlearning.com/chinese/grammar/ASGOUD8U
要 做 完 这 个 工作 需要 一 两 个 月 。,要做完这个工作需要一两个月。,yào zuò wán zhè gè gōngzuò xūyào yī liǎng gè yuè 。,It will take a month or two to finish this work.,[sound:hsk3_grammar_sent328.mp3],:: Number + (Number + 1) ::,Expressing quantity,Approximating with sequential numbers,https://resources.allsetlearning.com/chinese/grammar/ASGOUD8U
他们 家 的 孩子五 六 岁 了 吧 。,他们家的孩子五六岁了吧。,tāmen jiā de háizǐwǔ lìu sùi le ba 。,Their children are five or six years old.,[sound:hsk3_grammar_sent329.mp3],:: Number + (Number + 1) ::,Expressing quantity,Approximating with sequential numbers,https://resources.allsetlearning.com/chinese/grammar/ASGOUD8U
这 件 衣服 只 要 七 八 十 块 钱 。,这件衣服只要七八十块钱。,zhè jiàn yīfú zhǐ yào qī bā shí kuài qián 。,This dress costs only seven or eighty dollars.,[sound:hsk3_grammar_sent330.mp3],:: Number + (Number + 1) ::,Expressing quantity,Approximating with sequential numbers,https://resources.allsetlearning.com/chinese/grammar/ASGOUD8U
这 几 本 书 花 了 我 两 三 百 。,这几本书花了我两三百。,zhè jī běn shū huā le wǒ liǎng sān bǎi 。,These books cost me two or three hundred.,[sound:hsk3_grammar_sent331.mp3],:: Number + (Number + 1) ::,Expressing quantity,Approximating with sequential numbers,https://resources.allsetlearning.com/chinese/grammar/ASGOUD8U
我 读 ，你 听 着 。,我读，你听着。,wǒ dú ，nǐ tīng zháo 。,"I read, you listen.",[sound:hsk3_grammar_sent332.mp3],:: Verb + 着 ::,"Indicating conditions, Expressing duration","Aspect particle ""zhe""",https://resources.allsetlearning.com/chinese/grammar/ASGOIDEO
我们 做 ，你们 看 着 。,我们做，你们看着。,wǒmen zuò ，nǐmen kàn zháo 。,"We do, you guys watch.",[sound:hsk3_grammar_sent333.mp3],:: Verb + 着 ::,"Indicating conditions, Expressing duration","Aspect particle ""zhe""",https://resources.allsetlearning.com/chinese/grammar/ASGOIDEO
你们 坐 着 ，我 马上 回来 。,你们坐着，我马上回来。,nǐmen zuò zháo ，wǒ mǎshàng húilái 。,"You sit down, and I will come back immediately.",[sound:hsk3_grammar_sent334.mp3],:: Verb + 着 ::,"Indicating conditions, Expressing duration","Aspect particle ""zhe""",https://resources.allsetlearning.com/chinese/grammar/ASGOIDEO
我 出去 一下 ，你 帮 我 看 着 行李 。,我出去一下，你帮我看着行李。,wǒ chūqù yīxià ，nǐ bāng wǒ kàn zháo xínglǐ 。,"Let me go out, you help me look at the luggage.",[sound:hsk3_grammar_sent335.mp3],:: Verb + 着 ::,"Indicating conditions, Expressing duration","Aspect particle ""zhe""",https://resources.allsetlearning.com/chinese/grammar/ASGOIDEO
她 喜欢 站 着 吃饭 。,她喜欢站着吃饭。,tā xǐhuān zhàn zháo chīfàn 。,She likes to stand and eat.,[sound:hsk3_grammar_sent336.mp3],:: Verb 1 + 着 + Verb 2 ::,"Indicating conditions, Expressing duration","Aspect particle ""zhe""",https://resources.allsetlearning.com/chinese/grammar/ASGOIDEO
他 笑 着 说 “对不起” 。,他笑着说“对不起”。,tā xiào zháo shuō “dùibùqǐ” 。,"He smiled and said ""I'm sorry"".",[sound:hsk3_grammar_sent337.mp3],:: Verb 1 + 着 + Verb 2 ::,"Indicating conditions, Expressing duration","Aspect particle ""zhe""",https://resources.allsetlearning.com/chinese/grammar/ASGOIDEO
孩子 抱 着 爸爸 哭 了 起来 。,孩子抱着爸爸哭了起来。,háizǐ bào zháo bàbà kū le qǐlái 。,The child cried while holding his father.,[sound:hsk3_grammar_sent338.mp3],:: Verb 1 + 着 + Verb 2 ::,"Indicating conditions, Expressing duration","Aspect particle ""zhe""",https://resources.allsetlearning.com/chinese/grammar/ASGOIDEO
公司 的 门 开 着 ，可是 没 人 在 。,公司的门开着，可是没人在。,gōngsī de mén kāi zháo ，kěshì méi rén zài 。,"The company's door was open, but no one was there.",[sound:hsk3_grammar_sent339.mp3],:: Verb + 着 ::,"Indicating conditions, Expressing duration","Aspect particle ""zhe""",https://resources.allsetlearning.com/chinese/grammar/ASGOIDEO
她 穿 着 一 条 小 黑 裙 。,她穿着一条小黑裙。,tā chuān zháo yī tiáo xiǎo hēi qún 。,She is wearing a little black dress.,[sound:hsk3_grammar_sent340.mp3],:: Verb + 着 ::,"Indicating conditions, Expressing duration","Aspect particle ""zhe""",https://resources.allsetlearning.com/chinese/grammar/ASGOIDEO
躺 着 最 舒服 。,躺着最舒服。,tǎng zháo zùi shūfú 。,It is most comfortable to lie down.,[sound:hsk3_grammar_sent341.mp3],:: Verb + 着 ::,"Indicating conditions, Expressing duration","Aspect particle ""zhe""",https://resources.allsetlearning.com/chinese/grammar/ASGOIDEO
别 客气 ，拿 着 吧 。,别客气，拿着吧。,bié kèqì ，ná zháo ba 。,"You're welcome, take it.",[sound:hsk3_grammar_sent342.mp3],:: Verb + 着 ::,"Indicating conditions, Expressing duration","Aspect particle ""zhe""",https://resources.allsetlearning.com/chinese/grammar/ASGOIDEO
你们 等 着 !,你们等着!,nǐmen děng zháo !,You guys wait!,[sound:hsk3_grammar_sent343.mp3],:: Verb + 着 ::,"Indicating conditions, Expressing duration","Aspect particle ""zhe""",https://resources.allsetlearning.com/chinese/grammar/ASGOIDEO
你 不要 生气 ，我 是 说 着 玩 的 。,你不要生气，我是说着玩的。,nǐ bùyào shēngqì ，wǒ shì shuō zháo wán de 。,"Don't be angry, I mean play.",[sound:hsk3_grammar_sent344.mp3],:: Subj. + 是 + Verb + 着 + 玩 + 的 ::,"Indicating conditions, Expressing duration","Aspect particle ""zhe""",https://resources.allsetlearning.com/chinese/grammar/ASGOIDEO
我 听不懂 英文 歌 ，只 是 听 着 玩 的 。,我听不懂英文歌，只是听着玩的。,wǒ tīngbùdǒng yīngwén gē ，zhǐ shì tīng zháo wán de 。,"I don't understand English songs, I just listen to them.",[sound:hsk3_grammar_sent345.mp3],:: Subj. + 是 + Verb + 着 + 玩 + 的 ::,"Indicating conditions, Expressing duration","Aspect particle ""zhe""",https://resources.allsetlearning.com/chinese/grammar/ASGOIDEO
我 饿 了 。,我饿了。,wǒ è le 。,I'm hungry.,[sound:hsk3_grammar_sent346.mp3],:: Subj. (+ 不) + Verb / Adj. + 了 ::,"Indicating conditions, Expressing result, Referring to changes of situation","Change of state with ""le""",https://resources.allsetlearning.com/chinese/grammar/ASGT185D
孩子们 都 累 了 。,孩子们都累了。,háizǐmen dū lèi le 。,The children are tired.,[sound:hsk3_grammar_sent347.mp3],:: Subj. (+ 不) + Verb / Adj. + 了 ::,"Indicating conditions, Expressing result, Referring to changes of situation","Change of state with ""le""",https://resources.allsetlearning.com/chinese/grammar/ASGT185D
妈妈 老 了 。,妈妈老了。,māmā lǎo le 。,Mom is old.,[sound:hsk3_grammar_sent348.mp3],:: Subj. (+ 不) + Verb / Adj. + 了 ::,"Indicating conditions, Expressing result, Referring to changes of situation","Change of state with ""le""",https://resources.allsetlearning.com/chinese/grammar/ASGT185D
你 胖 了 。,你胖了。,nǐ pàng le 。,You are fat.,[sound:hsk3_grammar_sent349.mp3],:: Subj. (+ 不) + Verb / Adj. + 了 ::,"Indicating conditions, Expressing result, Referring to changes of situation","Change of state with ""le""",https://resources.allsetlearning.com/chinese/grammar/ASGT185D
你 是不是 生气 了 ？,你是不是生气了？,nǐ shìbùshì shēngqì le ？,Are you angry?,[sound:hsk3_grammar_sent350.mp3],:: Subj. (+ 不) + Verb / Adj. + 了 ::,"Indicating conditions, Expressing result, Referring to changes of situation","Change of state with ""le""",https://resources.allsetlearning.com/chinese/grammar/ASGT185D
下雨 了 。,下雨了。,xiàyǔ le 。,It's raining.,[sound:hsk3_grammar_sent351.mp3],:: Subj. (+ 不) + Verb / Adj. + 了 ::,"Indicating conditions, Expressing result, Referring to changes of situation","Change of state with ""le""",https://resources.allsetlearning.com/chinese/grammar/ASGT185D
宝宝 会 说话 了 。,宝宝会说话了。,bǎobǎo hùi shuōhuà le 。,The baby can talk.,[sound:hsk3_grammar_sent352.mp3],:: Subj. (+ 不) + Verb / Adj. + 了 ::,"Indicating conditions, Expressing result, Referring to changes of situation","Change of state with ""le""",https://resources.allsetlearning.com/chinese/grammar/ASGT185D
他 当 经理 了 。,他当经理了。,tā dāng jīnglǐ le 。,He has become a manager.,[sound:hsk3_grammar_sent353.mp3],:: Subj. (+ 不) + Verb / Adj. + 了 ::,"Indicating conditions, Expressing result, Referring to changes of situation","Change of state with ""le""",https://resources.allsetlearning.com/chinese/grammar/ASGT185D
你 有 女朋友 了 ？,你有女朋友了？,nǐ yǒu nv̌péngyǒu le ？,Do you have a girlfriend?,[sound:hsk3_grammar_sent354.mp3],:: Subj. (+ 不) + Verb / Adj. + 了 ::,"Indicating conditions, Expressing result, Referring to changes of situation","Change of state with ""le""",https://resources.allsetlearning.com/chinese/grammar/ASGT185D
我 男朋友 找到 新 工作 了 。,我男朋友找到新工作了。,wǒ nánpéngyǒu zhǎodào xīn gōngzuò le 。,My boyfriend has found a new job.,[sound:hsk3_grammar_sent355.mp3],:: Subj. (+ 不) + Verb / Adj. + 了 ::,"Indicating conditions, Expressing result, Referring to changes of situation","Change of state with ""le""",https://resources.allsetlearning.com/chinese/grammar/ASGT185D
我 不 买 了 。,我不买了。,wǒ bù mǎi le 。,I will not buy it.,[sound:hsk3_grammar_sent356.mp3],:: Subj. (+ 不) + Verb / Adj. + 了 ::,"Indicating conditions, Expressing result, Referring to changes of situation","Change of state with ""le""",https://resources.allsetlearning.com/chinese/grammar/ASGT185D
我 不 回家 吃 晚饭 了 。,我不回家吃晚饭了。,wǒ bù húijiā chī wǎnfàn le 。,I will not go home for dinner.,[sound:hsk3_grammar_sent357.mp3],:: Subj. (+ 不) + Verb / Adj. + 了 ::,"Indicating conditions, Expressing result, Referring to changes of situation","Change of state with ""le""",https://resources.allsetlearning.com/chinese/grammar/ASGT185D
我 不 去 看电影 了 。,我不去看电影了。,wǒ bù qù kàndiànyǐng le 。,I don't go to the movies anymore.,[sound:hsk3_grammar_sent358.mp3],:: Subj. (+ 不) + Verb / Adj. + 了 ::,"Indicating conditions, Expressing result, Referring to changes of situation","Change of state with ""le""",https://resources.allsetlearning.com/chinese/grammar/ASGT185D
我 不 结婚 了 。,我不结婚了。,wǒ bù jiéhūn le 。,I am not married.,[sound:hsk3_grammar_sent359.mp3],:: Subj. (+ 不) + Verb / Adj. + 了 ::,"Indicating conditions, Expressing result, Referring to changes of situation","Change of state with ""le""",https://resources.allsetlearning.com/chinese/grammar/ASGT185D
你 好 吗 ？我 很 好 。,你好吗？我很好。,nǐ hǎo ma ？wǒ hěn hǎo 。,How are you? I'm very good.,[sound:hsk3_grammar_sent360.mp3],:: Topic / [Missing Person / Thing] + 呢 ？ ::,"Asking questions, Expressing attitude","Questions with ""ne""",https://resources.allsetlearning.com/chinese/grammar/ASGMJHZO
我 也 很 好 。,我也很好。,wǒ yě hěn hǎo 。,I am fine too.,[sound:hsk3_grammar_sent361.mp3],:: Topic / [Missing Person / Thing] + 呢 ？ ::,"Asking questions, Expressing attitude","Questions with ""ne""",https://resources.allsetlearning.com/chinese/grammar/ASGMJHZO
这 个 很 好 ， 那 个 呢 ？,这个很好，那个呢？,zhè gè hěn hǎo ， nà gè ní ？,"This is good, what about that?",[sound:hsk3_grammar_sent362.mp3],:: Topic / [Missing Person / Thing] + 呢 ？ ::,"Asking questions, Expressing attitude","Questions with ""ne""",https://resources.allsetlearning.com/chinese/grammar/ASGMJHZO
这 个 用 中文 怎么 说 ？,这个用中文怎么说？,zhè gè yòng zhōngwén zěnyāo shuō ？,How do you say this in Chinese?,[sound:hsk3_grammar_sent363.mp3],:: Topic / [Missing Person / Thing] + 呢 ？ ::,"Asking questions, Expressing attitude","Questions with ""ne""",https://resources.allsetlearning.com/chinese/grammar/ASGMJHZO
我 在 家，你 呢 ？,我在家，你呢？,wǒ zài jiā，nǐ ní ？,"I'm at home, how about you?",[sound:hsk3_grammar_sent364.mp3],:: Topic / [Missing Person / Thing] + 呢 ？ ::,"Asking questions, Expressing attitude","Questions with ""ne""",https://resources.allsetlearning.com/chinese/grammar/ASGMJHZO
你 爸爸 是 上海 人 ，你 妈妈 呢 ？,你爸爸是上海人，你妈妈呢？,nǐ bàbà shì shànghǎi rén ，nǐ māmā ní ？,"Your father is from Shanghai, what about your mother?",[sound:hsk3_grammar_sent365.mp3],:: Topic / [Missing Person / Thing] + 呢 ？ ::,"Asking questions, Expressing attitude","Questions with ""ne""",https://resources.allsetlearning.com/chinese/grammar/ASGMJHZO
你 哥哥 有 工作，弟弟 呢 ？,你哥哥有工作，弟弟呢？,nǐ gēgē yǒu gōngzuò，dìdì ní ？,"Your brother has a job, what about his brother?",[sound:hsk3_grammar_sent366.mp3],:: Topic / [Missing Person / Thing] + 呢 ？ ::,"Asking questions, Expressing attitude","Questions with ""ne""",https://resources.allsetlearning.com/chinese/grammar/ASGMJHZO
北京 下雨 了 。,北京下雨了。,běijīng xiàyǔ le 。,It's raining in Beijing.,[sound:hsk3_grammar_sent367.mp3],:: Topic / [Missing Person / Thing] + 呢 ？ ::,"Asking questions, Expressing attitude","Questions with ""ne""",https://resources.allsetlearning.com/chinese/grammar/ASGMJHZO
我 现在 要 出去 。,我现在要出去。,wǒ xiànzài yào chūqù 。,I am going out now.,[sound:hsk3_grammar_sent368.mp3],:: Topic / [Missing Person / Thing] + 呢 ？ ::,"Asking questions, Expressing attitude","Questions with ""ne""",https://resources.allsetlearning.com/chinese/grammar/ASGMJHZO
我 知道 你 会 说 中文 。,我知道你会说中文。,wǒ zhīdào nǐ hùi shuō zhōngwén 。,I know you can speak Chinese.,[sound:hsk3_grammar_sent369.mp3],:: Topic / [Missing Person / Thing] + 呢 ？ ::,"Asking questions, Expressing attitude","Questions with ""ne""",https://resources.allsetlearning.com/chinese/grammar/ASGMJHZO
这 个 周末 我 想 去 酒吧 。,这个周末我想去酒吧。,zhè gè zhōumò wǒ xiǎng qù jǐuba 。,I want to go to the bar this weekend.,[sound:hsk3_grammar_sent370.mp3],:: Topic / [Missing Person / Thing] + 呢 ？ ::,"Asking questions, Expressing attitude","Questions with ""ne""",https://resources.allsetlearning.com/chinese/grammar/ASGMJHZO
今天 晚上 没 空 ？,今天晚上没空？,jīntiān wǎnshàng méi kōng ？,Not free tonight?,[sound:hsk3_grammar_sent371.mp3],:: Topic / [Missing Person / Thing] + 呢 ？ ::,"Asking questions, Expressing attitude","Questions with ""ne""",https://resources.allsetlearning.com/chinese/grammar/ASGMJHZO
钱 呢 ？,钱呢？,qián ní ？,What about money?,[sound:hsk3_grammar_sent372.mp3],:: Topic / [Missing Person / Thing] + 呢 ？ ::,"Asking questions, Expressing attitude","Questions with ""ne""",https://resources.allsetlearning.com/chinese/grammar/ASGMJHZO
你 妈妈 呢 ？,你妈妈呢？,nǐ māmā ní ？,where is your mom?,[sound:hsk3_grammar_sent373.mp3],:: Topic / [Missing Person / Thing] + 呢 ？ ::,"Asking questions, Expressing attitude","Questions with ""ne""",https://resources.allsetlearning.com/chinese/grammar/ASGMJHZO
我 的 手机 呢 ？,我的手机呢？,wǒ de shǒujī ní ？,What about my cell phone?,[sound:hsk3_grammar_sent374.mp3],:: Topic / [Missing Person / Thing] + 呢 ？ ::,"Asking questions, Expressing attitude","Questions with ""ne""",https://resources.allsetlearning.com/chinese/grammar/ASGMJHZO
小李 的 房子,小李的房子,xiǎolǐ de fángzǐ,Xiao Li's house,[sound:hsk3_grammar_sent375.mp3],:: 的 + Noun :: / :: Verb + 得 :: / :: Adj. + 地 + Verb ::,,"Structural particle ""de""",https://resources.allsetlearning.com/chinese/grammar/ASG5MOMM
红色 的 自行车,红色的自行车,hóngsè de zìxíngchē,Red bicycle,[sound:hsk3_grammar_sent376.mp3],:: 的 + Noun :: / :: Verb + 得 :: / :: Adj. + 地 + Verb ::,,"Structural particle ""de""",https://resources.allsetlearning.com/chinese/grammar/ASG5MOMM
我 的 手机,我的手机,wǒ de shǒujī,My cell phone,[sound:hsk3_grammar_sent377.mp3],:: 的 + Noun :: / :: Verb + 得 :: / :: Adj. + 地 + Verb ::,,"Structural particle ""de""",https://resources.allsetlearning.com/chinese/grammar/ASG5MOMM
我们 的 老师,我们的老师,wǒmen de lǎoshī,our teacher,[sound:hsk3_grammar_sent378.mp3],:: 的 + Noun :: / :: Verb + 得 :: / :: Adj. + 地 + Verb ::,,"Structural particle ""de""",https://resources.allsetlearning.com/chinese/grammar/ASG5MOMM
漂亮 的 衣服,漂亮的衣服,piāoliàng de yīfú,beautiful clothes,[sound:hsk3_grammar_sent379.mp3],:: 的 + Noun :: / :: Verb + 得 :: / :: Adj. + 地 + Verb ::,,"Structural particle ""de""",https://resources.allsetlearning.com/chinese/grammar/ASG5MOMM
热闹 的 酒吧,热闹的酒吧,rènào de jǐuba,Lively bar,[sound:hsk3_grammar_sent380.mp3],:: 的 + Noun :: / :: Verb + 得 :: / :: Adj. + 地 + Verb ::,,"Structural particle ""de""",https://resources.allsetlearning.com/chinese/grammar/ASG5MOMM
我 女朋友 的 公司,我女朋友的公司,wǒ nv̌péngyǒu de gōngsī,My girlfriend's company,[sound:hsk3_grammar_sent381.mp3],:: 的 + Noun :: / :: Verb + 得 :: / :: Adj. + 地 + Verb ::,,"Structural particle ""de""",https://resources.allsetlearning.com/chinese/grammar/ASG5MOMM
做 得 很 好,做得很好,zuò dé hěn hǎo,well-done,[sound:hsk3_grammar_sent382.mp3],:: 的 + Noun :: / :: Verb + 得 :: / :: Adj. + 地 + Verb ::,,"Structural particle ""de""",https://resources.allsetlearning.com/chinese/grammar/ASG5MOMM
说 得 太 快,说得太快,shuō dé tài kuài,Speak too fast,[sound:hsk3_grammar_sent383.mp3],:: 的 + Noun :: / :: Verb + 得 :: / :: Adj. + 地 + Verb ::,,"Structural particle ""de""",https://resources.allsetlearning.com/chinese/grammar/ASG5MOMM
玩 得 很 开心,玩得很开心,wán dé hěn kāixīn,Have fun,[sound:hsk3_grammar_sent384.mp3],:: 的 + Noun :: / :: Verb + 得 :: / :: Adj. + 地 + Verb ::,,"Structural particle ""de""",https://resources.allsetlearning.com/chinese/grammar/ASG5MOMM
开 得 很 快,开得很快,kāi dé hěn kuài,Drive fast,[sound:hsk3_grammar_sent385.mp3],:: 的 + Noun :: / :: Verb + 得 :: / :: Adj. + 地 + Verb ::,,"Structural particle ""de""",https://resources.allsetlearning.com/chinese/grammar/ASG5MOMM
住 得 很 舒服,住得很舒服,zhù dé hěn shūfú,Live comfortably,[sound:hsk3_grammar_sent386.mp3],:: 的 + Noun :: / :: Verb + 得 :: / :: Adj. + 地 + Verb ::,,"Structural particle ""de""",https://resources.allsetlearning.com/chinese/grammar/ASG5MOMM
生气 地 说,生气地说,shēngqì dì shuō,Say angrily,[sound:hsk3_grammar_sent387.mp3],:: 的 + Noun :: / :: Verb + 得 :: / :: Adj. + 地 + Verb ::,,"Structural particle ""de""",https://resources.allsetlearning.com/chinese/grammar/ASG5MOMM
开心 地 笑,开心地笑,kāixīn dì xiào,Laugh happily,[sound:hsk3_grammar_sent388.mp3],:: 的 + Noun :: / :: Verb + 得 :: / :: Adj. + 地 + Verb ::,,"Structural particle ""de""",https://resources.allsetlearning.com/chinese/grammar/ASG5MOMM
慢慢 地 走,慢慢地走,mànmàn dì zǒu,Walk slowly,[sound:hsk3_grammar_sent389.mp3],:: 的 + Noun :: / :: Verb + 得 :: / :: Adj. + 地 + Verb ::,,"Structural particle ""de""",https://resources.allsetlearning.com/chinese/grammar/ASG5MOMM
伤心 地 哭,伤心地哭,shāngxīn dì kū,Crying sadly,[sound:hsk3_grammar_sent390.mp3],:: 的 + Noun :: / :: Verb + 得 :: / :: Adj. + 地 + Verb ::,,"Structural particle ""de""",https://resources.allsetlearning.com/chinese/grammar/ASG5MOMM
认真 地 听,认真地听,rènzhēn dì tīng,Listen carefully,[sound:hsk3_grammar_sent391.mp3],:: 的 + Noun :: / :: Verb + 得 :: / :: Adj. + 地 + Verb ::,,"Structural particle ""de""",https://resources.allsetlearning.com/chinese/grammar/ASG5MOMM
今天 的 作业 你 做 得 不好，因为 你 没 认真 地 听课 。,今天的作业你做得不好，因为你没认真地听课。,jīntiān de zuòyè nǐ zuò dé bùhǎo，yīnwèi nǐ méi rènzhēn dì tīngkè 。,You did not do well in your homework today because you did not take the class seriously.,[sound:hsk3_grammar_sent392.mp3],:: 的 + Noun :: / :: Verb + 得 :: / :: Adj. + 地 + Verb ::,,"Structural particle ""de""",https://resources.allsetlearning.com/chinese/grammar/ASG5MOMM
关于 中国 历史，我 知道 的 不 多 。,关于中国历史，我知道的不多。,guānyú zhōngguó lìshǐ，wǒ zhīdào de bù duō 。,I do n’t know much about Chinese history.,[sound:hsk3_grammar_sent393.mp3],:: 关于 + Obj. ，⋯⋯ ::,Expressing attitude,"Expressing ""about"" with ""guanyu""",https://resources.allsetlearning.com/chinese/grammar/ASG49888
关于 这 次 考试，我 还 有 几 个 问题 要 问 。,关于这次考试，我还有几个问题要问。,guānyú zhè cì kǎoshì，wǒ huán yǒu jī gè wèntí yào wèn 。,I have a few questions to ask about this exam.,[sound:hsk3_grammar_sent394.mp3],:: 关于 + Obj. ，⋯⋯ ::,Expressing attitude,"Expressing ""about"" with ""guanyu""",https://resources.allsetlearning.com/chinese/grammar/ASG49889
关于 这个 问题，你们 还是 问 他 吧 。,关于这个问题，你们还是问他吧。,guānyú zhègè wèntí，nǐmen huánshì wèn tā ba 。,"Regarding this question, you should ask him.",[sound:hsk3_grammar_sent395.mp3],:: 关于 + Obj. ，⋯⋯ ::,Expressing attitude,"Expressing ""about"" with ""guanyu""",https://resources.allsetlearning.com/chinese/grammar/ASG49889
关于 你 的 建议，老板 还 在 考虑 。,关于你的建议，老板还在考虑。,guānyú nǐ de jiànyì，lǎobǎn huán zài kǎolv̀ 。,"Regarding your suggestion, the boss is still considering.",[sound:hsk3_grammar_sent396.mp3],:: 关于 + Obj. ，⋯⋯ ::,Expressing attitude,"Expressing ""about"" with ""guanyu""",https://resources.allsetlearning.com/chinese/grammar/ASG49889
关于 调查 结果，我们 也 不 太 清楚 。,关于调查结果，我们也不太清楚。,guānyú diàochá jiéguǒ，wǒmen yě bù tài qīngchǔ 。,We are not very clear about the results of the investigation.,[sound:hsk3_grammar_sent397.mp3],:: 关于 + Obj. ，⋯⋯ ::,Expressing attitude,"Expressing ""about"" with ""guanyu""",https://resources.allsetlearning.com/chinese/grammar/ASG49889
网上 有 很 多 关于 这 件 事情 的 评论 。,网上有很多关于这件事情的评论。,wǎngshàng yǒu hěn duō guānyú zhè jiàn shìqíng de pínglùn 。,There are many comments on this matter online.,[sound:hsk3_grammar_sent398.mp3],:: 关于 ⋯⋯ 的 + Noun ::,Expressing attitude,"Expressing ""about"" with ""guanyu""",https://resources.allsetlearning.com/chinese/grammar/ASG49889
他 写 过 很 多 关于 男女 平等 的 文章 。,他写过很多关于男女平等的文章。,tā xiě guò hěn duō guānyú nánnv̌ píngděng de wénzhāng 。,He has written many articles about equality between men and women.,[sound:hsk3_grammar_sent399.mp3],:: 关于 ⋯⋯ 的 + Noun ::,Expressing attitude,"Expressing ""about"" with ""guanyu""",https://resources.allsetlearning.com/chinese/grammar/ASG49889
汉语 有 很 多 关于 饮食 的 成语 。,汉语有很多关于饮食的成语。,hànyǔ yǒu hěn duō guānyú yǐnshí de chéngyǔ 。,There are many idioms about diet in Chinese.,[sound:hsk3_grammar_sent400.mp3],:: 关于 ⋯⋯ 的 + Noun ::,Expressing attitude,"Expressing ""about"" with ""guanyu""",https://resources.allsetlearning.com/chinese/grammar/ASG49889
我 昨天 看 了 一 部 关于 动物 保护 的 纪录片 。,我昨天看了一部关于动物保护的纪录片。,wǒ zuótiān kàn le yī bù guānyú dòngwù bǎohù de jìlùpiàn 。,I watched a documentary about animal protection yesterday.,[sound:hsk3_grammar_sent401.mp3],:: 关于 ⋯⋯ 的 + Noun ::,Expressing attitude,"Expressing ""about"" with ""guanyu""",https://resources.allsetlearning.com/chinese/grammar/ASG49889
这 是 一 份 关于 中国 奢侈品 市场 的 报告 。,这是一份关于中国奢侈品市场的报告。,zhè shì yī fèn guānyú zhōngguó shēchǐpǐn shìcháng de bàogào 。,This is a report on the Chinese luxury goods market.,[sound:hsk3_grammar_sent402.mp3],:: 关于 ⋯⋯ 的 + Noun ::,Expressing attitude,"Expressing ""about"" with ""guanyu""",https://resources.allsetlearning.com/chinese/grammar/ASG49889
我们 聊聊 你 的 新 工作 吧 。,我们聊聊你的新工作吧。,wǒmen liáoliáo nǐ de xīn gōngzuò ba 。,Let's talk about your new job.,[sound:hsk3_grammar_sent403.mp3],:: 关于 ⋯⋯ 的 + Noun ::,Expressing attitude,"Expressing ""about"" with ""guanyu""",https://resources.allsetlearning.com/chinese/grammar/ASG49889
今天 开会 要 说说 公司 下 个 月 的 培训 。,今天开会要说说公司下个月的培训。,jīntiān kāihùi yào shuōshuō gōngsī xià gè yuè de péixùn 。,Today's meeting will talk about the company's training next month.,[sound:hsk3_grammar_sent404.mp3],:: 关于 ⋯⋯ 的 + Noun ::,Expressing attitude,"Expressing ""about"" with ""guanyu""",https://resources.allsetlearning.com/chinese/grammar/ASG49889
