
老师 每 天 都 给 我们 很多 作业 。,老师每天都给我们很多作业。,lǎoshī měi tiān dū gěi wǒmen hěnduō zuòyè 。,The teacher gives us a lot of homework every day.,[sound:hsk2_grammar_sent696.mp3],:: 每 + Measure Word + Noun + 都 ::,,"Expressing ""every"" with ""mei""",https://resources.allsetlearning.com/chinese/grammar/ASGB6L4M
我们 每 周 都 要 开会 。,我们每周都要开会。,wǒmen měi zhōu dū yào kāihùi 。,We meet every week.,[sound:hsk2_grammar_sent697.mp3],:: 每 + Measure Word + Noun + 都 ::,,"Expressing ""every"" with ""mei""",https://resources.allsetlearning.com/chinese/grammar/ASGB6L4M
他们 每 个 周末 都 去 公园 。,他们每个周末都去公园。,tāmen měi gè zhōumò dū qù gōngyuán 。,They go to the park every weekend.,[sound:hsk2_grammar_sent698.mp3],:: 每 + Measure Word + Noun + 都 ::,,"Expressing ""every"" with ""mei""",https://resources.allsetlearning.com/chinese/grammar/ASGB6L4M
我 是 第 一 个 到 公司 的 人 。,我是第一个到公司的人。,wǒ shì dì yī gè dào gōngsī de rén 。,I am the first to come to the company.,[sound:hsk2_grammar_sent699.mp3],:: 第 + Number +（ Measure Word + Noun） ::,Expressing order,"Ordinal numbers with ""di""",https://resources.allsetlearning.com/chinese/grammar/ASGK904U
他 要 坐 早上 第 一 班 地铁 去 上班 。,他要坐早上第一班地铁去上班。,tā yào zuò zǎoshàng dì yī bān dìtiě qù shàngbān 。,He will take the first subway in the morning to go to work.,[sound:hsk2_grammar_sent700.mp3],:: 第 + Number +（ Measure Word + Noun） ::,Expressing order,"Ordinal numbers with ""di""",https://resources.allsetlearning.com/chinese/grammar/ASGK904U
小李 是 她 的 第 三 个 男朋友 。,小李是她的第三个男朋友。,xiǎolǐ shì tā de dì sān gè nánpéngyǒu 。,Xiao Li is her third boyfriend.,[sound:hsk2_grammar_sent701.mp3],:: 第 + Number +（ Measure Word + Noun） ::,Expressing order,"Ordinal numbers with ""di""",https://resources.allsetlearning.com/chinese/grammar/ASGK904U
我 的 第 一 个中文 老师 是 美国 人 。,我的第一个中文老师是美国人。,wǒ de dì yī gèzhōngwén lǎoshī shì měiguó rén 。,My first Chinese teacher was an American.,[sound:hsk2_grammar_sent702.mp3],:: 第 + Number +（ Measure Word + Noun） ::,Expressing order,"Ordinal numbers with ""di""",https://resources.allsetlearning.com/chinese/grammar/ASGK904U
爸爸 的 第 一 个手机 是 NOKIA 。,爸爸的第一个手机是NOKIA。,bàbà de dì yī gèshǒujī shì NOKIA 。,Dad's first mobile phone is NOKIA.,[sound:hsk2_grammar_sent703.mp3],:: 第 + Number +（ Measure Word + Noun） ::,Expressing order,"Ordinal numbers with ""di""",https://resources.allsetlearning.com/chinese/grammar/ASGK904U
你 的 第 一 个工作 是 什么 ？,你的第一个工作是什么？,nǐ de dì yī gègōngzuò shì shíyāo ？,What was your first job?,[sound:hsk2_grammar_sent704.mp3],:: 第 + Number +（ Measure Word + Noun） ::,Expressing order,"Ordinal numbers with ""di""",https://resources.allsetlearning.com/chinese/grammar/ASGK904U
到 美国 的 第 二个 月，我 找到 了 工作 。,到美国的第二个月，我找到了工作。,dào měiguó de dì èrgè yuè，wǒ zhǎodào le gōngzuò 。,"In my second month in the US, I found a job.",[sound:hsk2_grammar_sent705.mp3],:: 第 + Number +（ Measure Word + Noun） ::,Expressing order,"Ordinal numbers with ""di""",https://resources.allsetlearning.com/chinese/grammar/ASGK904U
第 二 行 第 五 个 汉字 怎么 读 ？,第二行第五个汉字怎么读？,dì èr xíng dì wǔ gè hànzì zěnyāo dú ？,How to read the fifth Chinese character in the second line?,[sound:hsk2_grammar_sent706.mp3],:: 第 + Number +（ Measure Word + Noun） ::,Expressing order,"Ordinal numbers with ""di""",https://resources.allsetlearning.com/chinese/grammar/ASGK904U
这 次 考试，我 是 我们 班 第 一 。,这次考试，我是我们班第一。,zhè cì kǎoshì，wǒ shì wǒmen bān dì yī 。,"This time, I am the first in our class.",[sound:hsk2_grammar_sent707.mp3],:: 第 + Number +（ Measure Word + Noun） ::,Expressing order,"Ordinal numbers with ""di""",https://resources.allsetlearning.com/chinese/grammar/ASGK904U
这 次 比赛，我们 班 第 一，他们 班 第 二 。,这次比赛，我们班第一，他们班第二。,zhè cì bǐsài，wǒmen bān dì yī，tāmen bān dì èr 。,"In this competition, our class is first, and their class is second.",[sound:hsk2_grammar_sent708.mp3],:: 第 + Number +（ Measure Word + Noun） ::,Expressing order,"Ordinal numbers with ""di""",https://resources.allsetlearning.com/chinese/grammar/ASGK904U
第 一 天，我们 在 宾馆 里 。,第一天，我们在宾馆里。,dì yī tiān，wǒmen zài bīnguǎn lǐ 。,"On the first day, we were in the hotel.",[sound:hsk2_grammar_sent709.mp3],:: 第 + Number +（ Measure Word + Noun） ::,Expressing order,"Ordinal numbers with ""di""",https://resources.allsetlearning.com/chinese/grammar/ASGK904U
来 上海 以后 的 第 二 年，他 开 了 这 家 公司 。,来上海以后的第二年，他开了这家公司。,lái shànghǎi yǐhòu de dì èr nián，tā kāi le zhè jiā gōngsī 。,"The second year after coming to Shanghai, he opened this company.",[sound:hsk2_grammar_sent710.mp3],:: 第 + Number +（ Measure Word + Noun） ::,Expressing order,"Ordinal numbers with ""di""",https://resources.allsetlearning.com/chinese/grammar/ASGK904U
下 个 月 的 第 一 周 老板 要 出差 。,下个月的第一周老板要出差。,xià gè yuè de dì yī zhōu lǎobǎn yào chūchà 。,The boss will travel on the first week of next month.,[sound:hsk2_grammar_sent711.mp3],:: 第 + Number +（ Measure Word + Noun） ::,Expressing order,"Ordinal numbers with ""di""",https://resources.allsetlearning.com/chinese/grammar/ASGK904U
这 是 我 第 一 次 去 北京 。,这是我第一次去北京。,zhè shì wǒ dì yī cì qù běijīng 。,This is my first time to Beijing.,[sound:hsk2_grammar_sent712.mp3],:: 第 + Number +（ Measure Word + Noun） ::,Expressing order,"Ordinal numbers with ""di""",https://resources.allsetlearning.com/chinese/grammar/ASGK904U
是 不 是 ？,是不是？,shì bù shì ？,is not it?,[sound:hsk2_grammar_sent713.mp3],:: Verb + 不 + Verb ::,"Asking questions, Giving alternatives",Affirmative-negative question,https://resources.allsetlearning.com/chinese/grammar/ASGZH7K2
他们 来 不 来 ？,他们来不来？,tāmen lái bù lái ？,Will they come?,[sound:hsk2_grammar_sent714.mp3],:: Verb + 不 + Verb ::,"Asking questions, Giving alternatives",Affirmative-negative question,https://resources.allsetlearning.com/chinese/grammar/ASGZH7K3
你 想 不 想 我 ？,你想不想我？,nǐ xiǎng bù xiǎng wǒ ？,Do you want me?,[sound:hsk2_grammar_sent715.mp3],:: Verb + 不 + Verb ::,"Asking questions, Giving alternatives",Affirmative-negative question,https://resources.allsetlearning.com/chinese/grammar/ASGZH7K3
我们 要 去 酒吧， 你 去 不 去 ？,我们要去酒吧，你去不去？,wǒmen yào qù jǐuba， nǐ qù bù qù ？,"We are going to the bar, do you want to go?",[sound:hsk2_grammar_sent716.mp3],:: Verb + 不 + Verb ::,"Asking questions, Giving alternatives",Affirmative-negative question,https://resources.allsetlearning.com/chinese/grammar/ASGZH7K3
我 去 买 咖啡 ，你 要 不 要 ？,我去买咖啡，你要不要？,wǒ qù mǎi kāfēi ，nǐ yào bù yào ？,"I want to buy coffee, do you want it?",[sound:hsk2_grammar_sent717.mp3],:: Verb + 不 + Verb ::,"Asking questions, Giving alternatives",Affirmative-negative question,https://resources.allsetlearning.com/chinese/grammar/ASGZH7K3
你 回 不 回 家 ？,你回不回家？,nǐ húi bù húi jiā ？,Can't you go home?,[sound:hsk2_grammar_sent718.mp3],:: Subj. + Verb + 不 + Verb + Obj. ::,"Asking questions, Giving alternatives",Affirmative-negative question,https://resources.allsetlearning.com/chinese/grammar/ASGZH7K3
她 吃 不 吃 鱼 ？,她吃不吃鱼？,tā chī bù chī yú ？,Does she eat fish?,[sound:hsk2_grammar_sent719.mp3],:: Subj. + Verb + 不 + Verb + Obj. ::,"Asking questions, Giving alternatives",Affirmative-negative question,https://resources.allsetlearning.com/chinese/grammar/ASGZH7K3
你们 要 不 要 米饭 ？,你们要不要米饭？,nǐmen yào bù yào mǐfàn ？,Do you want rice?,[sound:hsk2_grammar_sent720.mp3],:: Subj. + Verb + 不 + Verb + Obj. ::,"Asking questions, Giving alternatives",Affirmative-negative question,https://resources.allsetlearning.com/chinese/grammar/ASGZH7K3
你爸爸 喝 不 喝 酒 ？,你爸爸喝不喝酒？,nǐbàbà hē bù hē jǐu ？,Does your dad drink alcohol?,[sound:hsk2_grammar_sent721.mp3],:: Subj. + Verb + 不 + Verb + Obj. ::,"Asking questions, Giving alternatives",Affirmative-negative question,https://resources.allsetlearning.com/chinese/grammar/ASGZH7K3
今天 老板 来 不 来 办公室 ？,今天老板来不来办公室？,jīntiān lǎobǎn lái bù lái bàngōngshì ？,Will the boss come to the office today?,[sound:hsk2_grammar_sent722.mp3],:: Subj. + Verb + 不 + Verb + Obj. ::,"Asking questions, Giving alternatives",Affirmative-negative question,https://resources.allsetlearning.com/chinese/grammar/ASGZH7K3
好 不 好 ？,好不好？,hǎo bù hǎo ？,good or not?,[sound:hsk2_grammar_sent723.mp3],:: Adj. + 不 + Adj. ::,"Asking questions, Giving alternatives",Affirmative-negative question,https://resources.allsetlearning.com/chinese/grammar/ASGZH7K3
热 不 热 ？,热不热？,rè bù rè ？,Is it hot?,[sound:hsk2_grammar_sent724.mp3],:: Adj. + 不 + Adj. ::,"Asking questions, Giving alternatives",Affirmative-negative question,https://resources.allsetlearning.com/chinese/grammar/ASGZH7K3
他 帅 不 帅 ？,他帅不帅？,tā shuài bù shuài ？,Is he handsome?,[sound:hsk2_grammar_sent725.mp3],:: Adj. + 不 + Adj. ::,"Asking questions, Giving alternatives",Affirmative-negative question,https://resources.allsetlearning.com/chinese/grammar/ASGZH7K3
这里 的 咖啡 贵 不 贵 ？,这里的咖啡贵不贵？,zhèlǐ de kāfēi gùi bù gùi ？,Is the coffee here expensive?,[sound:hsk2_grammar_sent726.mp3],:: Adj. + 不 + Adj. ::,"Asking questions, Giving alternatives",Affirmative-negative question,https://resources.allsetlearning.com/chinese/grammar/ASGZH7K3
中国 菜 辣 不 辣 ？,中国菜辣不辣？,zhōngguó cài là bù là ？,Is Chinese food spicy?,[sound:hsk2_grammar_sent727.mp3],:: Adj. + 不 + Adj. ::,"Asking questions, Giving alternatives",Affirmative-negative question,https://resources.allsetlearning.com/chinese/grammar/ASGZH7K3
喜欢 不 喜欢 ？,喜欢不喜欢？,xǐhuān bù xǐhuān ？,Like it or not?,[sound:hsk2_grammar_sent728.mp3],:: [First Character of Adj.] + 不 + Adj. :: / :: [First Character of Verb] + 不 + Verb ::,"Asking questions, Giving alternatives",Affirmative-negative question,https://resources.allsetlearning.com/chinese/grammar/ASGZH7K3
喜 不 喜欢 ？,喜不喜欢？,xǐ bù xǐhuān ？,like or not?,[sound:hsk2_grammar_sent729.mp3],:: [First Character of Adj.] + 不 + Adj. :: / :: [First Character of Verb] + 不 + Verb ::,"Asking questions, Giving alternatives",Affirmative-negative question,https://resources.allsetlearning.com/chinese/grammar/ASGZH7K3
高兴 不 高兴 ？,高兴不高兴？,gāoxīng bù gāoxīng ？,Are you happy?,[sound:hsk2_grammar_sent730.mp3],:: [First Character of Adj.] + 不 + Adj. :: / :: [First Character of Verb] + 不 + Verb ::,"Asking questions, Giving alternatives",Affirmative-negative question,https://resources.allsetlearning.com/chinese/grammar/ASGZH7K3
高 不 高兴 ？,高不高兴？,gāo bù gāoxīng ？,High upset?,[sound:hsk2_grammar_sent731.mp3],:: [First Character of Adj.] + 不 + Adj. :: / :: [First Character of Verb] + 不 + Verb ::,"Asking questions, Giving alternatives",Affirmative-negative question,https://resources.allsetlearning.com/chinese/grammar/ASGZH7K3
他 女朋友 漂亮 不 漂亮 ？,他女朋友漂亮不漂亮？,tā nv̌péngyǒu piāoliàng bù piāoliàng ？,Is his girlfriend beautiful?,[sound:hsk2_grammar_sent732.mp3],:: [First Character of Adj.] + 不 + Adj. :: / :: [First Character of Verb] + 不 + Verb ::,"Asking questions, Giving alternatives",Affirmative-negative question,https://resources.allsetlearning.com/chinese/grammar/ASGZH7K3
他 女朋友 漂 不 漂亮 ？,他女朋友漂不漂亮？,tā nv̌péngyǒu piāo bù piāoliàng ？,Is his girlfriend beautiful?,[sound:hsk2_grammar_sent733.mp3],:: [First Character of Adj.] + 不 + Adj. :: / :: [First Character of Verb] + 不 + Verb ::,"Asking questions, Giving alternatives",Affirmative-negative question,https://resources.allsetlearning.com/chinese/grammar/ASGZH7K3
中国 菜 好吃 不 好吃 ？,中国菜好吃不好吃？,zhōngguó cài hǎochī bù hǎochī ？,Is Chinese food delicious?,[sound:hsk2_grammar_sent734.mp3],:: [First Character of Adj.] + 不 + Adj. :: / :: [First Character of Verb] + 不 + Verb ::,"Asking questions, Giving alternatives",Affirmative-negative question,https://resources.allsetlearning.com/chinese/grammar/ASGZH7K3
中国 菜 好 不 好吃 ？,中国菜好不好吃？,zhōngguó cài hǎo bù hǎochī ？,Is Chinese food delicious?,[sound:hsk2_grammar_sent735.mp3],:: [First Character of Adj.] + 不 + Adj. :: / :: [First Character of Verb] + 不 + Verb ::,"Asking questions, Giving alternatives",Affirmative-negative question,https://resources.allsetlearning.com/chinese/grammar/ASGZH7K3
那 个 地方 好玩 不 好玩 ？,那个地方好玩不好玩？,nà gè dìfāng hǎowán bù hǎowán ？,Is that place fun?,[sound:hsk2_grammar_sent736.mp3],:: [First Character of Adj.] + 不 + Adj. :: / :: [First Character of Verb] + 不 + Verb ::,"Asking questions, Giving alternatives",Affirmative-negative question,https://resources.allsetlearning.com/chinese/grammar/ASGZH7K3
那 个 地方 好 不 好玩 ？,那个地方好不好玩？,nà gè dìfāng hǎo bù hǎowán ？,Is that place fun?,[sound:hsk2_grammar_sent737.mp3],:: [First Character of Adj.] + 不 + Adj. :: / :: [First Character of Verb] + 不 + Verb ::,"Asking questions, Giving alternatives",Affirmative-negative question,https://resources.allsetlearning.com/chinese/grammar/ASGZH7K3
你 哥哥 有 没有 女 朋友 ？,你哥哥有没有女朋友？,nǐ gēgē yǒu méiyǒu nv̌ péngyǒu ？,Does your brother have a girlfriend?,[sound:hsk2_grammar_sent738.mp3],:: Subj. + 有 没有 + Obj. ::,"Asking questions, Giving alternatives",Affirmative-negative question,https://resources.allsetlearning.com/chinese/grammar/ASGZH7K3
你们 有 没有 孩子 ？,你们有没有孩子？,nǐmen yǒu méiyǒu háizǐ ？,Do you have any children?,[sound:hsk2_grammar_sent739.mp3],:: Subj. + 有 没有 + Obj. ::,"Asking questions, Giving alternatives",Affirmative-negative question,https://resources.allsetlearning.com/chinese/grammar/ASGZH7K3
奶奶 有 没有 坐 过 飞机 ？,奶奶有没有坐过飞机？,nǎinǎi yǒu méiyǒu zuò guò fēijī ？,Has grandma ever been on a plane?,[sound:hsk2_grammar_sent740.mp3],:: Subj. + 有 没有 + Obj. ::,"Asking questions, Giving alternatives",Affirmative-negative question,https://resources.allsetlearning.com/chinese/grammar/ASGZH7K3
他 有 没有 上 过 大学 ？,他有没有上过大学？,tā yǒu méiyǒu shàng guò dàxué ？,Has he ever gone to college?,[sound:hsk2_grammar_sent741.mp3],:: Subj. + 有 没有 + Obj. ::,"Asking questions, Giving alternatives",Affirmative-negative question,https://resources.allsetlearning.com/chinese/grammar/ASGZH7K3
他 怎么 还 没 来 ？,他怎么还没来？,tā zěnyāo huán méi lái ？,Why hasn't he come yet?,[sound:hsk2_grammar_sent742.mp3],:: Subj. + 怎么 + Verb + Obj. ? ::,"Asking questions, Exclaiming, Expressing attitude","Asking why with ""zenme""",https://resources.allsetlearning.com/chinese/grammar/ASGD7NS2
你们 怎么 打 人 ？,你们怎么打人？,nǐmen zěnyāo dǎ rén ？,How do you beat people?,[sound:hsk2_grammar_sent743.mp3],:: Subj. + 怎么 + Verb + Obj. ? ::,"Asking questions, Exclaiming, Expressing attitude","Asking why with ""zenme""",https://resources.allsetlearning.com/chinese/grammar/ASGD7NS3
他 帮 了 你，你 怎么 不 说 “谢谢” ？,他帮了你，你怎么不说“谢谢”？,tā bāng le nǐ，nǐ zěnyāo bù shuō “xièxiè” ？,"He helped you, why didn't you say ""thank you""?",[sound:hsk2_grammar_sent744.mp3],:: Subj. + 怎么 + Verb + Obj. ? ::,"Asking questions, Exclaiming, Expressing attitude","Asking why with ""zenme""",https://resources.allsetlearning.com/chinese/grammar/ASGD7NS3
你 结婚 的时候 怎么 不 告诉 我 ？,你结婚的时候怎么不告诉我？,nǐ jiéhūn deshíhòu zěnyāo bù gàosù wǒ ？,Why didn't you tell me when you got married?,[sound:hsk2_grammar_sent745.mp3],:: Subj. + 怎么 + Verb + Obj. ? ::,"Asking questions, Exclaiming, Expressing attitude","Asking why with ""zenme""",https://resources.allsetlearning.com/chinese/grammar/ASGD7NS3
我们 还 没 开始 吃，他 怎么 已经 吃完 了 ？,我们还没开始吃，他怎么已经吃完了？,wǒmen huán méi kāishǐ chī，tā zěnyāo yǐjīng chīwán le ？,"We haven't started eating yet, why has he finished it?",[sound:hsk2_grammar_sent746.mp3],:: Subj. + 怎么 + Verb + Obj. ? ::,"Asking questions, Exclaiming, Expressing attitude","Asking why with ""zenme""",https://resources.allsetlearning.com/chinese/grammar/ASGD7NS3
今天 是 星期一，你 怎么 不 去 上班 ？,今天是星期一，你怎么不去上班？,jīntiān shì xīngqīyī，nǐ zěnyāo bù qù shàngbān ？,"Today is Monday, why don't you go to work?",[sound:hsk2_grammar_sent747.mp3],:: Subj. + 怎么 + Verb + Obj. ? ::,"Asking questions, Exclaiming, Expressing attitude","Asking why with ""zenme""",https://resources.allsetlearning.com/chinese/grammar/ASGD7NS3
水 怎么 不 热 ？,水怎么不热？,shǔi zěnyāo bù rè ？,Why isn't the water hot?,[sound:hsk2_grammar_sent748.mp3],:: Subj. + 怎么 (+ 不) + Adj. ::,"Asking questions, Exclaiming, Expressing attitude","Asking why with ""zenme""",https://resources.allsetlearning.com/chinese/grammar/ASGD7NS3
这里 的 川菜 怎么 不 辣 ？,这里的川菜怎么不辣？,zhèlǐ de chuāncài zěnyāo bù là ？,Why isn't Sichuan food spicy here?,[sound:hsk2_grammar_sent749.mp3],:: Subj. + 怎么 (+ 不) + Adj. ::,"Asking questions, Exclaiming, Expressing attitude","Asking why with ""zenme""",https://resources.allsetlearning.com/chinese/grammar/ASGD7NS3
他 亲 了 你，你 怎么 不 高兴 ？,他亲了你，你怎么不高兴？,tā qīn le nǐ，nǐ zěnyāo bù gāoxīng ？,"He kissed you, why are you upset?",[sound:hsk2_grammar_sent750.mp3],:: Subj. + 怎么 (+ 不) + Adj. ::,"Asking questions, Exclaiming, Expressing attitude","Asking why with ""zenme""",https://resources.allsetlearning.com/chinese/grammar/ASGD7NS3
她 的 小猫 死 了，她 怎么 不 难过 ？,她的小猫死了，她怎么不难过？,tā de xiǎomāo sǐ le，tā zěnyāo bù nánguò ？,"Her kitten is dead, why isn't she sad?",[sound:hsk2_grammar_sent751.mp3],:: Subj. + 怎么 (+ 不) + Adj. ::,"Asking questions, Exclaiming, Expressing attitude","Asking why with ""zenme""",https://resources.allsetlearning.com/chinese/grammar/ASGD7NS3
每 天 工作 十二 个 小时 ，你 怎么 不 累 ？,每天工作十二个小时，你怎么不累？,měi tiān gōngzuò shíèr gè xiǎoshí ，nǐ zěnyāo bù lèi ？,"Working twelve hours a day, why are you not tired?",[sound:hsk2_grammar_sent752.mp3],:: Subj. + 怎么 (+ 不) + Adj. ::,"Asking questions, Exclaiming, Expressing attitude","Asking why with ""zenme""",https://resources.allsetlearning.com/chinese/grammar/ASGD7NS3
他 怎么 那么 懒 ？,他怎么那么懒？,tā zěnyāo nàyāo lǎn ？,Why is he so lazy?,[sound:hsk2_grammar_sent753.mp3],:: Subj. + 怎么 + 这么 / 那么 + Adj. ::,"Asking questions, Exclaiming, Expressing attitude","Asking why with ""zenme""",https://resources.allsetlearning.com/chinese/grammar/ASGD7NS3
昨天 怎么 那么 冷 ？,昨天怎么那么冷？,zuótiān zěnyāo nàyāo lěng ？,Why was it so cold yesterday?,[sound:hsk2_grammar_sent754.mp3],:: Subj. + 怎么 + 这么 / 那么 + Adj. ::,"Asking questions, Exclaiming, Expressing attitude","Asking why with ""zenme""",https://resources.allsetlearning.com/chinese/grammar/ASGD7NS3
这些人 怎么 这么 吵 ？,这些人怎么这么吵？,zhèxiērén zěnyāo zhèyāo chǎo ？,Why are these people so noisy?,[sound:hsk2_grammar_sent755.mp3],:: Subj. + 怎么 + 这么 / 那么 + Adj. ::,"Asking questions, Exclaiming, Expressing attitude","Asking why with ""zenme""",https://resources.allsetlearning.com/chinese/grammar/ASGD7NS3
北京 的 空气 怎么 那么 差 ？,北京的空气怎么那么差？,běijīng de kōngqì zěnyāo nàyāo chà ？,Why is the air in Beijing so bad?,[sound:hsk2_grammar_sent756.mp3],:: Subj. + 怎么 + 这么 / 那么 + Adj. ::,"Asking questions, Exclaiming, Expressing attitude","Asking why with ""zenme""",https://resources.allsetlearning.com/chinese/grammar/ASGD7NS3
你的 汉语 怎么 这么 好 ？,你的汉语怎么这么好？,nǐde hànyǔ zěnyāo zhèyāo hǎo ？,How is your Chinese so good?,[sound:hsk2_grammar_sent757.mp3],:: Subj. + 怎么 + 这么 / 那么 + Adj. ::,"Asking questions, Exclaiming, Expressing attitude","Asking why with ""zenme""",https://resources.allsetlearning.com/chinese/grammar/ASGD7NS3
A: 你 看 到 我 的 手机 了 吗 ？,A:你看到我的手机了吗？,A: nǐ kàn dào wǒ de shǒujī le ma ？,A: Did you see my mobile phone?,[sound:hsk2_grammar_sent758.mp3],(能……吗？) / (不是……吗？ ) / ( 怎么会……？ ) / ( 谁让你……？),"Asking questions, Expressing attitude",Simple rhetorical questions,https://resources.allsetlearning.com/chinese/grammar/ASGD4EC8
B:不 是 在 桌子 上 吗 ？,B:不是在桌子上吗？,B:bù shì zài zhuōzǐ shàng ma ？,B: Isn't it on the table?,[sound:hsk2_grammar_sent759.mp3],(能……吗？) / (不是……吗？ ) / ( 怎么会……？ ) / ( 谁让你……？),"Asking questions, Expressing attitude",Simple rhetorical questions,https://resources.allsetlearning.com/chinese/grammar/ASGD4EC8
A: 我们 什么 时候 开会 ？,A:我们什么时候开会？,A: wǒmen shíyāo shíhòu kāihùi ？,A: When will we meet?,[sound:hsk2_grammar_sent760.mp3],(能……吗？) / (不是……吗？ ) / ( 怎么会……？ ) / ( 谁让你……？),"Asking questions, Expressing attitude",Simple rhetorical questions,https://resources.allsetlearning.com/chinese/grammar/ASGD4EC8
B:不 是 已经 告诉 你 了 吗 ？,B:不是已经告诉你了吗？,B:bù shì yǐjīng gàosù nǐ le ma ？,B: Didn't I tell you?,[sound:hsk2_grammar_sent761.mp3],(能……吗？) / (不是……吗？ ) / ( 怎么会……？ ) / ( 谁让你……？),"Asking questions, Expressing attitude",Simple rhetorical questions,https://resources.allsetlearning.com/chinese/grammar/ASGD4EC8
A: 今天 放假 了，好 开心 。,A:今天放假了，好开心。,A: jīntiān fàngjiǎ le，hǎo kāixīn 。,"A: I have a holiday today, so happy.",[sound:hsk2_grammar_sent762.mp3],(能……吗？) / (不是……吗？ ) / ( 怎么会……？ ) / ( 谁让你……？),"Asking questions, Expressing attitude",Simple rhetorical questions,https://resources.allsetlearning.com/chinese/grammar/ASGD4EC8
B:不 是 明天 放假 吗 ？,B:不是明天放假吗？,B:bù shì míngtiān fàngjiǎ ma ？,B: Isn't it a holiday tomorrow?,[sound:hsk2_grammar_sent763.mp3],(能……吗？) / (不是……吗？ ) / ( 怎么会……？ ) / ( 谁让你……？),"Asking questions, Expressing attitude",Simple rhetorical questions,https://resources.allsetlearning.com/chinese/grammar/ASGD4EC8
A: 他 又 感冒 了 。,A:他又感冒了。,A: tā yòu gǎnmào le 。,A: He has a cold again.,[sound:hsk2_grammar_sent764.mp3],(能……吗？) / (不是……吗？ ) / ( 怎么会……？ ) / ( 谁让你……？),"Asking questions, Expressing attitude",Simple rhetorical questions,https://resources.allsetlearning.com/chinese/grammar/ASGD4EC8
B: 他 每天 穿得 都 很少，能 不 感冒 吗 ？,B:他每天穿得都很少，能不感冒吗？,B: tā měitiān chuāndé dū hěnshǎo，néng bù gǎnmào ma ？,"B: He wears very little every day, can he not catch a cold?",[sound:hsk2_grammar_sent765.mp3],(能……吗？) / (不是……吗？ ) / ( 怎么会……？ ) / ( 谁让你……？),"Asking questions, Expressing attitude",Simple rhetorical questions,https://resources.allsetlearning.com/chinese/grammar/ASGD4EC8
A: 今天 我 可能 会 迟到 。,A:今天我可能会迟到。,A: jīntiān wǒ kěnéng hùi chídào 。,A: I may be late today.,[sound:hsk2_grammar_sent766.mp3],(能……吗？) / (不是……吗？ ) / ( 怎么会……？ ) / ( 谁让你……？),"Asking questions, Expressing attitude",Simple rhetorical questions,https://resources.allsetlearning.com/chinese/grammar/ASGD4EC8
B:你 起得 这么 晚，能 不 迟到 吗 ？,B:你起得这么晚，能不迟到吗？,B:nǐ qǐdé zhèyāo wǎn，néng bù chídào ma ？,"B: You get up so late, can you not be late?",[sound:hsk2_grammar_sent767.mp3],(能……吗？) / (不是……吗？ ) / ( 怎么会……？ ) / ( 谁让你……？),"Asking questions, Expressing attitude",Simple rhetorical questions,https://resources.allsetlearning.com/chinese/grammar/ASGD4EC8
